{"$schema":"https://json-schema.org/draft/2020-12/schema","title":"Census","type":"object","required":["page","national","benefits"],"properties":{"page":{"type":"object"},"national":{"type":"object"},"benefits":{"type":"array"},"lastChecked":{"type":["string","null"]}},"additionalProperties":false}
