{
  "page": {
    "title": "Census Data",
    "description": "Official national figures for Hazara ancestry and the Hazaragi language in Australia.",
    "banner": "assets/images/banners/sydney-1024.webp",
    "buttonLabel": "11 August 2026",
    "date": "11 August 2026",
    "sectionHeading": "Official Census Numbers for Australian Hazaras",
    "whyEyebrow": "Why It Matters",
    "whyHeading": "A strong count builds a stronger future.",
    "whyDescription": "The Census helps show how communities are represented and how resources are planned."
  },
  "national": {
    "source2021": "https://www.abs.gov.au/census/find-census-data",
    "2021": {
      "hazaraAncestry": 41766,
      "hazaragiLanguage": 41678,
      "status": "official"
    },
    "2026": {
      "hazaraAncestry": null,
      "hazaragiLanguage": null,
      "status": "coming-soon"
    }
  },
  "benefits": [
    {
      "icon": "representation",
      "title": "Fair Representation",
      "description": "An accurate count helps ensure our community is seen and our voices are heard."
    },
    {
      "icon": "services",
      "title": "Better Services",
      "description": "Stronger numbers help support schools, health care, roads and local services."
    },
    {
      "icon": "resources",
      "title": "More Resources",
      "description": "Funding and programs can be informed by accurate community information."
    },
    {
      "icon": "future",
      "title": "Stronger Future",
      "description": "Today’s count helps shape opportunities and outcomes for tomorrow."
    }
  ],
  "lastChecked": null
}
